Paguem, A; Abanda, B; Achukwi, MD; Baskaran, P; Czemmel, S; Renz, A; Eisenbarth, A	Whole genome characterization of autochthonousBos taurus brachycerosand introducedBos indicus indicuscattle breeds in Cameroon regarding their adaptive phenotypic traits and pathogen resistance	BMC GENETICS	Whole genome sequencing; Trypanotolerance; Bos taurus; Namchi; Kapsiki; Bos indicus; white Fulani; Red Fulani; Gudali; Cameroon	Background African indigenous taurine cattle display unique adaptive traits shaped by husbandry management, regional climate and exposure to endemic pathogens. They are less productive with respect to milk and meat production which has been associated with amongst others, small size, traditional beliefs, husbandry practices, limited feed resources, disease burden and lack of sustained breeding for trait improvement. This resulted in the severe dwindling of their population size rendering them vulnerable to extinction. The Namchi taurine cattle breed is referred to as [Namchi (Doayo)] and shows resistance traits against trypanosome infection and exposure to tick infestation. Nonetheless, the historically later introduced Zebu cattle are the main cattle breeds in Africa today, even though they suffer more from locally prevailing pathogens. By using a whole genome sequencing approach, we sequenced with high depth for the first time the genomes of five cattle breeds from Cameroon in order to provide a valuable genetic resource for future African cattle breeding: the Namchi, an endangered trypano-tolerant taurine breed, the Kapsiki, an indigenous trypano-susceptible taurine breed, and three Zebu (Bos indicus indicus) breeds: Ngaoundere Gudali, White Fulani and Red Fulani. Results Approximately 167 Gigabases of raw sequencing data were generated for each breed and mapped to the cattle reference genomes ARS-UCD1.2 and UMD3.1.The coverage was 103 to 140-fold when aligning the reads to ARS-UCD1.2 with an average mapping rate of similar to 99%, and 22 to 30-fold when aligning the reads to UMD3.1 with an average mapping rate of similar to 64%. The single nucleotide polymorphisms (SNPs) obtained from analysis using the genome ARS-UCD1.2 were compared with reference genomes of EuropeanBos taurusHolstein, the AsianBos indicusBrahman, and the African trypanotolerant N'Dama breeds. A total of similar to 100 million (M) SNPs were identified and 7.7 M of those were breed-specific. An approximately 11.1 M constituted of small insertions and deletions. By using only breed-specific non-synonymous variants we identified genes as genetic signatures and associated Gene Ontology (GO) terms that could explain certain cattle-breed specific phenotypes such as increased tolerance against trypanosome parasites in the Namchi breed and heat tolerance in the Kapsiki breed. Phylogenetic analysis grouped, except for Namchi, theBos taurusbreeds Kapsiki, N'Dama and Holstein together while theB. indicusbreeds White and Red Fulani, Gudali and Brahman clustered separately. The deviating result for Namchi indicates a hybrid status of the selected animal with a recent introgression of Zebu genes into its genome. Conclusions The findings provide the first comprehensive set of genome-wide variant data of the most important Cameroonian cattle breeds. The genomic data shall constitute a foundation for breed amelioration whilst exploiting the heritable traits and support conservation efforts for the endangered local cattle breeds.	BMC GENET	2020	10.1186/s12863-020-00869-9	Mammals	Artiodactyla	Bos	TRUE	TRUE	no stats of interest	TRUE	phylogentic approaches	WGS	TRUE
Wagner, DN; Curry, RL; Chen, N; Lovette, IJ; Taylor, SA	Genomic regions underlying metabolic and neuronal signaling pathways are temporally consistent in a moving avian hybrid zone	EVOLUTION	Chickadee; hybrid index; glutamate; synaptic transmission; tension zone	The study of hybrid zones can provide insight into the genetic basis of species differences that are relevant for the maintenance of reproductive isolation. Hybrid zones can also provide insight into climate change, species distributions, and evolution. The hybrid zone between black-capped chickadees (Poecile atricapillus) and Carolina chickadees (Poecile carolinensis) is shifting northward in response to increasing winter temperatures but is not increasing in width. This pattern indicates strong selection against chickadees with admixed genomes. Using high-resolution genomic data, we identified regions of the genomes that are outliers in both time points and do not introgress between the species; these regions may be involved in the maintenance of reproductive isolation. Genes involved in metabolic regulation processes were overrepresented in this dataset. Several gene ontology categories were also temporally consistent-including glutamate signaling, synaptic transmission, and catabolic processes-but the nucleotide variants leading to this pattern were not. Our results support recent findings that hybrids between black-capped and Carolina chickadees have higher basal metabolic rates than either parental species and suffer spatial memory and problem-solving deficits. Metabolic breakdown, as well as spatial memory and problem-solving, in hybrid chickadees may act as strong postzygotic isolation mechanisms in this moving hybrid zone.	EVOLUTION	2020	10.1111/evo.13970	Birds	Passeriformes	Poecile	TRUE	TRUE	no stats of interest	TRUE	cline analysis, sequence similarity	GBS	TRUE
Liu, CX; Li, PH; Zhou, WD; Ma, X; Wang, XP; Xu, Y; Jiang, NJ; Zhao, MR; Zhou, TW; Yin, YZ; Ren, J; Huang, RH	Genome Data Uncover Conservation Status, Historical Relatedness and Candidate Genes Under Selection in Chinese Indigenous Pigs in the Taihu Lake Region	FRONTIERS IN GENETICS	Taihu Lake region; indigenous pig; conservation status; historical relatedness; candidate gene	Chinese indigenous pig breeds in the Taihu Lake (TL) region of Eastern China are well documented by their exceptional prolificacy. There are seven breeds in this region including Meishan (MS), Erhualian (EHL), Jiaxing Black (JXB), Fengjing (FJ), Shawutou (SWT), Mi (MI), and Hongdenglong (HDL). At present, these breeds are facing a great threat of population decline, inbreeding depression and lineage admixture since Western commercial pigs have dominated in Chinese pig industry. To provide better conservation strategies and identify candidate genes under selection for these breeds, we explored genome-wide single nucleotide polymorphism (SNP) markers to uncover genetic variability and relatedness, population structure, historical admixture and genomic signature of selection of 440 pigs representing the most comprehensive lineages of these breeds in TL region in a context of 1228 pigs from 45 Eurasian breeds. We showed that these breeds were more closely related to each other as compared to other Eurasian breeds, defining one of the main ancestral lineages of Chinese indigenous pigs. These breeds can be divided into two subgroups, one including JXB and FJ, and the other comprising of EHL, MI, HDL, MS, and SWT. In addition, HDL was highly inbred whereas EHL and MS had more abundant genetic diversity owing to their multiple conservation populations. Moreover, we identified a list of candidate genes under selection for body size and prolificacy. Our results would benefit the conservation of these valuable breeds and improve our understanding of the genetic mechanisms of body size and fecundity in pigs.	FRONT GENET	2020	10.3389/fgene.2020.00591	Mammals	Artiodactyla	Sus	TRUE	TRUE	no stats of interest	TRUE	ADMIXTURE, sequence similarity, demographic inference	microarray	TRUE
Wu, MY; Low, GW; Forcina, G; van Grouw, H; Lee, BPYH; Oh, RRY; Rheindt, FE	Historic and modern genomes unveil a domestic introgression gradient in a wild red junglefowl population	EVOLUTIONARY APPLICATIONS	admixture; conservation genomics; genetic swamping; phenotypic introgression; South-East Asia	The red junglefowl Gallus gallus is the ancestor of the domestic chicken and arguably the most important bird species on Earth. Continual gene flow between domestic and wild populations has compromised its gene pool, especially since the last century when human encroachment and habitat loss would have led to increased contact opportunities. We present the first combined genomic and morphological admixture assessment of a native population of red junglefowl, sampled from recolonized parts of its former range in Singapore, partly using whole genomes resequenced from dozens of individuals. Crucially, this population was genomically anchored to museum samples from adjacent Peninsular Malaysia collected similar to 110-150 years ago to infer the magnitude of modern domestic introgression across individuals. We detected a strong feral-wild genomic continuum with varying levels of domestic introgression in different subpopulations across Singapore. Using a trait scoring scheme, we determined morphological thresholds that can be used by conservation managers to successfully identify individuals with low levels of domestic introgression, and selected traits that were particularly useful for predicting domesticity in genomic profiles. Our study underscores the utility of combined genomic and morphological approaches in population management and suggests a way forward to safeguard the allelic integrity of wild red junglefowl in perpetuity.	EVOL APPL	2020	10.1111/eva.13023	Birds	Galliformes	Gallus	TRUE	TRUE	no stats of interest	TRUE	morphology, STRUCTURE	WGS	TRUE
Tonzo, V; Papadopoulou, A; Ortego, J	Genomic footprints of an old affair: Single nucleotide polymorphism data reveal historical hybridization and the subsequent evolution of reproductive barriers in two recently diverged grasshoppers with partly overlapping distributions	MOLECULAR ECOLOGY	coalescent-based simulations; ddRAD-seq; hybridization; introgression; reproductive isolation	Secondary contact in close relatives can result in hybridization and the admixture of previously isolated gene pools. However, after an initial period of hybridization, reproductive isolation can evolve through different processes and lead to the interruption of gene flow and the completion of the speciation process. Omocestus minutissimus and O. uhagonii are two closely related grasshoppers with partially overlapping distributions in the Central System mountains of the Iberian Peninsula. To analyse spatial patterns of historical and/or contemporary hybridization between these two taxa and understand how species boundaries are maintained in the region of secondary contact, we sampled sympatric and allopatric populations of the two species and obtained genome-wide single nucleotide polymorphism data using a restriction site-associated DNA sequencing approach. We used Bayesian clustering analyses to test the hypothesis of contemporary hybridization in sympatric populations and employed a suite of phylogenomic approaches and a coalescent-based simulation framework to evaluate alternative hypothetical scenarios of interspecific gene flow. Our analyses rejected the hypothesis of contemporary hybridization but revealed past introgression in the area where the distributions of the two species overlap. Overall, these results point to a scenario of historical gene flow after secondary contact followed by the evolution of reproductive isolation that currently prevents hybridization among sympatric populations.	MOL ECOL	2020	10.1111/mec.15475	Insects	Orthoptera	Omocestus	TRUE	FALSE		TRUE	D, FASTSTRUCTURE, phylogentic approaches, sequence similarity, demographic inference	RAD	TRUE
Mizerovska, D; Mikula, O; Meheretu, Y; Bartakova, V; Bryjova, A; Kostin, DS; Sumbera, R; Lavrenchenko, LA; Bryja, J	Integrative taxonomic revision of the Ethiopian endemic rodent genus Stenocephalemys (Muridae: Murinae: Praomyini) with the description of two new species	JOURNAL OF VERTEBRATE BIOLOGY	taxonomy; Ethiopian Highlands; mitogenomics; distribution; mammals; Ethiopian rats; morphometry	Ethiopian rats (genus Stenocephalemys) represent a monophyletic group of Ethiopian endemic rodents that diverged in the Ethiopian Highlands during the Pleistocene. Because of the frequent occurrence of so-called reticulate evolution (i.e. repeated hybridization of partially diverged populations), their taxonomy has not been adequately resolved, despite the fact that they belong to the most abundant rodent genus in Ethiopia and are important as pests and carriers of pathogens (e.g. hantaviruses). Here we analysed material for 623 Stenocephalemys specimens using integrative taxonomy composed of genomic analyses (388 nuclear markers and complete mitogenomes), 2D-geometric morphometry of skulls and classical morphometry of external traits. The genus consists of six clearly defined gene pools (= species), characterized by specific morphology, ecology and distribution. Two of them, described here as new species, live in fragmented populations in Afroalpine habitats in the north-western part of the Ethiopian Highlands. We also showed that mitochondrial DNA is not applicable as a universal diagnostic tool for species discrimination in Stenocephalemys, because of multiple cases of mitochondrial introgression. This finding illustrates the utility of the genus as a suitable model for future studies of mito-nuclear coevolution along an elevational gradient.	J VERTEBR BIOL	2020	10.25225/jvb.20031	Mammals	Rodentia	Stenocephalemys	TRUE	TRUE	no stats of interest	TRUE	phylogentic approaches	microarray	TRUE
Duranton, M; Allal, F; Valiere, S; Bouchez, O; Bonhomme, F; Gagnaire, PA	The contribution of ancient admixture to reproductive isolation between European sea bass lineages	EVOLUTION LETTERS	Ancient admixture; introgression; reproductive isolation; genomic conflicts; marine fish	Understanding how new species arise through the progressive establishment of reproductive isolation (RI) barriers between diverging populations is a major goal in Evolutionary Biology. An important result of speciation genomics studies is that genomic regions involved in RI frequently harbor anciently diverged haplotypes that predate the reconstructed history of species divergence. The possible origins of these old alleles remain much debated, as they relate to contrasting mechanisms of speciation that are not yet fully understood. In the European sea bass (Dicentrarchus labrax), the genomic regions involved in RI between Atlantic and Mediterranean lineages are enriched for anciently diverged alleles of unknown origin. Here, we used haplotype-resolved whole-genome sequences to test whether divergent haplotypes could have originated from a closely related species, the spotted sea bass (Dicentrarchus punctatus). We found that an ancient admixture event betweenD. labraxandD. punctatusis responsible for the presence of shared derived alleles that segregate at low frequencies in both lineages ofD. labrax. An exception to this was found within regions involved in RI between the twoD. labraxlineages. In those regions, archaic tracts originating fromD. punctatuslocally reached high frequencies or even fixation in Atlantic genomes but were almost absent in the Mediterranean. We showed that the ancient admixture event most likely occurred betweenD. punctatusand theD. labraxAtlantic lineage, while Atlantic and MediterraneanD. labraxlineages were experiencing allopatric isolation. Our results suggest that local adaptive introgression and/or the resolution of genomic conflicts provoked by ancient admixture have probably contributed to the establishment of RI between the twoD. labraxlineages.	EVOL LETT	2020	10.1002/evl3.169	Fish	Perciformes	Dicentrarchus	TRUE	TRUE	plotted values but did not report them 	TRUE	RNDmin, D, fd, phylogentic approaches, sequence similarity, demographic inference	WGS	TRUE
Taskent, O; Lin, YL; Patramanis, I; Pavlidis, P; Gokcumen, O	Analysis of Haplotypic Variation and Deletion Polymorphisms Point to Multiple Archaic Introgression Events, Including from Altai Neanderthal Lineage	GENETICS	Copy number variation; genomic structural variation; haplotype blocks; introgression; selection	Although analysis of modern and ancient genomes showed that Neanderthals contributed genetic material to the ancestors of extant human populations, when and where Neanderthals interacted with modern human populations remain exciting... The time, extent, and genomic effect of the introgressions from archaic humans into ancestors of extant human populations remain some of the most exciting venues of population genetics research in the past decade. Several studies have shown population-specific signatures of introgression events from Neanderthals, Denisovans, and potentially other unknown hominin populations in different human groups. Moreover, it was shown that these introgression events may have contributed to phenotypic variation in extant humans, with biomedical and evolutionary consequences. In this study, we present a comprehensive analysis of the unusually divergent haplotypes in the Eurasian genomes and show that they can be traced back to multiple introgression events. In parallel, we document hundreds of deletion polymorphisms shared with Neanderthals. A locus-specific analysis of one such shared deletion suggests the existence of a direct introgression event from the Altai Neanderthal lineage into the ancestors of extant East Asian populations. Overall, our study is in agreement with the emergent notion that various Neanderthal populations contributed to extant human genetic variation in a population-specific manner.	GENETICS	2020	10.1534/genetics.120.303167	Mammals	Primates	Homo	TRUE	TRUE	no stats of interest	TRUE	S*	WGS	TRUE
da Silva, R; Pedraza-Marron, CD; Sampaio, I; Betancur-R, R; Gomes, G; Schneider, H	New insights about species delimitation in red snappers (Lutjanus purpureus and L. campechanus) using multilocus data	MOLECULAR PHYLOGENETICS AND EVOLUTION	Lutjanus; Red snapper; Isolation with Migration	Lutjanus campechanus and Lutjanus purpureus are two commercially important lutjanid fishes (snappers) with non-sympatric distribution throughout Western Atlantic. Even though both taxa have traditionally been regarded as valid species, their taxonomic status remains under debate. In the present study, we used phylogeographic approaches and molecular methods of species delimitation to elucidate the taxonomic issues between both species, based on 1478 base pairs from four genomic regions. We found haplotypes shared between the two species, particularly in relation to nuclear DNA (nuDNA) sequences. The molecular delimitation of species supported the discrimination of L. purpureus and L. campechanus as distinct evolutionary units. Nonetheless, a unidirectional gene flow was found from L. campechanus towards L. purpureus. Therefore, it seems plausible to infer that L. campechanus and L. purpureus are two evolutionary units in which the apparent sharing of haplotypes should be driven by introgression.	MOL PHYLOGENET EVOL	2020	10.1016/j.ympev.2020.106780	Fish	Perciformes	Lutjanus	TRUE	TRUE	no stats of interest	TRUE	sequence similarity, demographic inference	Sanger	TRUE
McElroy, K; Black, A; Dolman, G; Horton, P; Pedler, L; Campbell, CD; Drew, A; Joseph, L	Robbery in progress: Historical museum collections bring to light a mitochondrial capture within a bird species widespread across southern Australia, the Copperback Quail-thrush Cinclosoma clarum	ECOLOGY AND EVOLUTION	Cinclosoma; mitochondrial capture; museum specimens; phylogeography; quail-thrush; southern Australia	We surveyed mitochondrial, autosomal, and Z chromosome diversity within and between the Copperback Quail-thrush Cinclosoma clarum and Chestnut Quail-thrush C. castanotum, which together span the arid and semi-arid zones of southern Australia, and primarily from specimens held in museum collections. We affirm the recent taxonomic separation of the two species and then focus on diversity within the more widespread of the two species, C. clarum. To guide further study of the system and what it offers to understanding the genomics of the differentiation and speciation processes, we develop and present a hypothesis to explain mitonuclear discordance that emerged in ourdata. Following a period of historical allopatry, secondary contact has resulted in an eastern mitochondrial genome replacing the western mitochondrial genome in western populations. This is predicted under a population-level invasion in the opposite direction, that of the western population invading the range of the eastern one. Mitochondrial captures can be driven by neutral, demographic processes, or adaptive mechanisms, and we favor the hypothesized capture being driven by neutral means. We cannot fully reject the adaptive process but suggest how these alternatives may be further tested. We acknowledge an alternative hypothesis, which finds some support in phenotypic data published elsewhere, namely that outcomes of secondary contact have been more complex than our current genomic data suggest. Discriminating and reconciling these two alternative hypotheses, which may not be mutually exclusive, could be tested with closer sampling at levels of population, individual, and nucleotide than has so far been possible. This would be further aided by knowledge of the genetic basis to phenotypic variation described elsewhere.	ECOL EVOL	2020	10.1002/ece3.6403	Birds	Passeriformes	Cinclosoma	TRUE	TRUE	no stats of interest	TRUE	sequence similarity, trees, STRUCTURE, PCoA	mtDNA, WGS	TRUE
Naval-Sanchez, M; Porto-Neto, LR; Cardoso, DF; Hayes, B; Daetwyler, HD; Kijas, J; Reverter, A	Selection signatures in tropical cattle are enriched for promoter and coding regions and reveal missense mutations in the damage response geneHELB	GENETICS SELECTION EVOLUTION		Background Distinct domestication events, adaptation to different climatic zones, and divergent selection in productive traits have shaped the genomic differences between taurine and indicine cattle. In this study, we assessed the impact of artificial selection and environmental adaptation by comparing whole-genome sequences from European taurine and Asian indicine breeds and from African cattle. Next, we studied the impact of divergent selection by exploiting predicted and experimental functional annotation of the bovine genome. Results We identified selective sweeps in beef cattle taurine and indicine populations, including a 430-kb selective sweep on indicine cattle chromosome 5 that is located between 47,670,001 and 48,100,000 bp and spans five genes, i.e.HELB,IRAK3,ENSBTAG00000026993,GRIP1and part ofHMGA2. Regions under selection in indicine cattle display significant enrichment for promoters and coding genes. At the nucleotide level, sites that show a strong divergence in allele frequency between European taurine and Asian indicine are enriched for the same functional categories. We identified nine single nucleotide polymorphisms (SNPs) in coding regions that are fixed for different alleles between subspecies, eight of which were located within theDNA helicase B(HELB) gene. By mining information from the 1000 Bull Genomes Project, we found thatHELBcarries mutations that are specific to indicine cattle but also found in taurine cattle, which are known to have been subject to indicine introgression from breeds, such as N'Dama, Anatolian Red, Marchigiana, Chianina, and Piedmontese. Based on in-house genome sequences, we proved that mutations inHELBsegregate independently of the copy number variationHMGA2-CNV, which is located in the same region. Conclusions Major genomic sequence differences betweenBos taurusandBos indicusare enriched for promoter and coding regions. We identified a 430-kb selective sweep in Asian indicine cattle located on chromosome 5, which carries SNPs that are fixed in indicine populations and located in the coding sequences of theHELBgene.HELBis involved in the response to DNA damage including exposure to ultra-violet light and is associated with reproductive traits and yearling weight in tropical cattle. Thus,HELBlikely contributed to the adaptation of tropical cattle to their harsh environment.	GENET SEL EVOL	2020	10.1186/s12711-020-00546-6	Mammals	Artiodactyla	Bos	TRUE	TRUE	no stats of interest	TRUE	sequence similarity	WGS	TRUE
