Lutgen, D; Ritter, R; Olsen, RA; Schielzeth, H; Gruselius, J; Ewels, P; Garcia, JT; Shirihai, H; Schweizer, M; Suh, A; Burri, R	Linked-read sequencing enables haplotype-resolved resequencing at population scale	MOLECULAR ECOLOGY RESOURCES	admixture; demography; introgression; phasing; population genomics; selective sweeps	The feasibility to sequence entire genomes of virtually any organism provides unprecedented insights into the evolutionary history of populations and species. Nevertheless, many population genomic inferences - including the quantification and dating of admixture, introgression and demographic events, and inference of selective sweeps - are still limited by the lack of high-quality haplotype information. The newest generation of sequencing technology now promises significant progress. To establish the feasibility of haplotype-resolved genome resequencing at population scale, we investigated properties of linked-read sequencing data of songbirds of the genusOenantheacross a range of sequencing depths. Our results based on the comparison of downsampled (25x, 20x, 15x, 10x, 7x, and 5x) with high-coverage data (46-68x) of seven bird genomes mapped to a reference suggest that phasing contiguities and accuracies adequate for most population genomic analyses can be reached already with moderate sequencing effort. At 15x coverage, phased haplotypes span about 90% of the genome assembly, with 50% and 90% of phased sequences located in phase blocks longer than 1.25-4.6 Mb (N50) and 0.27-0.72 Mb (N90). Phasing accuracy reaches beyond 99% starting from 15x coverage. Higher coverages yielded higher contiguities (up to about 7 Mb/1 Mb [N50/N90] at 25x coverage), but only marginally improved phasing accuracy. Phase block contiguity improved with input DNA molecule length; thus, higher-quality DNA may help keeping sequencing costs at bay. In conclusion, even for organisms with gigabase-sized genomes like birds, linked-read sequencing at moderate depth opens an affordable avenue towards haplotype-resolved genome resequencing at population scale.	MOL ECOL RESOUR		10.1111/1755-0998.13192	  			TRUE	TRUE	methods paper	FALSE			FALSE
Fang, BH; Kemppainen, P; Momigliano, P; Feng, XY; Merila, J	On the causes of geographically heterogeneous parallel evolution in sticklebacks	NATURE ECOLOGY & EVOLUTION		The three-spined stickleback (Gasterosteus aculeatus) is an important model system for the study of parallel evolution in the wild, having repeatedly colonized and adapted to freshwater from the sea throughout the northern hemisphere. Previous studies identified numerous genomic regions showing consistent genetic differentiation between freshwater and marine ecotypes but these had typically limited geographic sampling and mostly focused on the Eastern Pacific region. We analysed population genomic data from global samples of the three-spined stickleback marine and freshwater ecotypes to detect loci involved in parallel evolution at different geographic scales. Most signatures of parallel evolution were unique to the Eastern Pacific and trans-oceanic marine-freshwater differentiation was restricted to a limited number of shared genomic regions, including three chromosomal inversions. On the basis of simulations and empirical data, we demonstrate that this could result from the stochastic loss of freshwater-adapted alleles during the invasion of the Atlantic basin and selection against freshwater-adapted variants in the sea, both of which can reduce standing genetic variation available for freshwater adaptation outside the Eastern Pacific region. Moreover, the elevated linkage disequilibrium associated with marine-freshwater differentiation in the Eastern Pacific is consistent with secondary contact between marine and freshwater populations that evolved in isolation from each other during past glacial periods. Thus, contrary to what earlier studies from the Eastern Pacific region have led us to believe, parallel marine-freshwater differentiation in sticklebacks is far less prevalent and pronounced in all other parts of the species global distribution range. Population genomic data from a global dataset of three-spined sticklebacks show that parallel signatures of marine to freshwater differentiation are less common than previously thought.	NAT ECOL EVOL		10.1038/s41559-020-1222-6	  			TRUE	TRUE	did not investigate introgression	FALSE			FALSE
Li, Z; Tirado, SB; Kadam, DC; Coffey, L; Miller, ND; Spalding, EP; Lorenz, AJ; de Leon, N; Kaeppler, SM; Schnable, PS; Springer, NM; Hirsch, CN	Characterizing introgression-by-environment interactions using maize near isogenic lines	THEORETICAL AND APPLIED GENETICS		Key message Significant introgression-by-environment interactions are observed for traits throughout development from small introgressed segments of the genome. Relatively small genomic introgressions containing quantitative trait loci can have significant impacts on the phenotype of an individual plant. However, the magnitude of phenotypic effects for the same introgression can vary quite substantially in different environments due to introgression-by-environment interactions. To study potential patterns of introgression-by-environment interactions, fifteen near-isogenic lines (NILs) with > 90% B73 genetic background and multiple Mo17 introgressions were grown in 16 different environments. These environments included five geographical locations with multiple planting dates and multiple planting densities. The phenotypic impact of the introgressions was evaluated for up to 26 traits that span different growth stages in each environment to assess introgression-by-environment interactions. Results from this study showed that small portions of the genome can drive significant genotype-by-environment interaction across a wide range of vegetative and reproductive traits, and the magnitude of the introgression-by-environment interaction varies across traits. Some introgressed segments were more prone to introgression-by-environment interaction than others when evaluating the interaction on a whole plant basis throughout developmental time, indicating variation in phenotypic plasticity throughout the genome. Understanding the profile of introgression-by-environment interaction in NILs is useful in consideration of how small introgressions of QTL or transgene containing regions might be expected to impact traits in diverse environments.	THEOR APPL GENET		10.1007/s00122-020-03630-z	  			TRUE	TRUE	manipulative cross	FALSE			FALSE
Hernandez, J; Meints, B; Hayes, P	Introgression Breeding in Barley: Perspectives and Case Studies	FRONTIERS IN PLANT SCIENCE	genetic resources; multi-rust resistance; haplotype; high throughput genotyping; genetic diversity; genetic mapping	Changing production scenarios resulting from unstable climatic conditions are challenging crop improvement efforts. A deeper and more practical understanding of plant genetic resources is necessary if these assets are to be used effectively in developing improved varieties. In general, current varieties and potential varieties have a narrow genetic base, making them prone to suffer the consequences of new and different abiotic and biotic stresses that can reduce crop yield and quality. The deployment of genomic technologies and sophisticated statistical analysis procedures has generated a dramatic change in the way we characterize and access genetic diversity in crop plants, including barley. Various mapping strategies can be used to identify the genetic variants that lead to target phenotypes and these variants can be assigned coordinates in reference genomes. In this way, new genes and/or new alleles at known loci present in wild ancestors, germplasm accessions, land races, and un-adapted introductions can be located and targeted for introgression. In principle, the introgression process can now be streamlined and linkage drag reduced. In this review, we present an overview of (1) past and current efforts to identify diversity that can be tapped to improve barley yield and quality, and (2) case studies of our efforts to introgress resistance to stripe and stem rust from un-adapted germplasm. We conclude with a description of a modified Nested Association Mapping (NAM) population strategy that we are implementing for the development of multi-use naked barley for organic systems and share perspectives on the use of genome editing in introgression breeding.	FRONT PLANT SCI		10.3389/fpls.2020.00761	  			TRUE	TRUE	review paper	FALSE			FALSE
Dissanayake, R; Braich, S; Cogan, NOI; Smith, K; Kaur, S	Characterization of Genetic and Allelic Diversity Amongst Cultivated and Wild Lentil Accessions for Germplasm Enhancement	FRONTIERS IN GENETICS	pulse; SNP markers; allele frequency; GenBank; sequence variant; gene annotation; introgression	Intensive breeding of cultivated lentil has resulted in a relatively narrow genetic base, which limits the options to increase crop productivity through selection. Assessment of genetic diversity in the wild gene pool of lentil, as well as characterization of useful and novel alleles/genes that can be introgressed into elite germplasm, presents new opportunities and pathways for germplasm enhancement, followed by successful crop improvement. In the current study, a lentil collection consisting of 467 wild and cultivated accessions that originated from 10 diverse geographical regions was assessed, to understand genetic relationships among different lentil species/subspecies. A total of 422,101 high-confidence SNP markers were identified against the reference lentil genome (cv. CDC Redberry). Phylogenetic analysis clustered the germplasm collection into four groups, namely,Lens culinaris/Lens orientalis,Lens lamottei/Lens odemensis,Lens ervoides, andLens nigricans. A weak correlation was observed between geographical origin and genetic relationship, except for some accessions ofL.culinarisandL.ervoides. Genetic distance matrices revealed a comparable level of variation within the gene pools ofL.culinaris(Nei's coefficient 0.01468-0.71163),L.ervoides(Nei's coefficient 0.01807-0.71877), andL.nigricans(Nei's coefficient 0.02188-1.2219). In order to understand any genic differences at species/subspecies level, allele frequencies were calculated from a subset of 263 lentil accessions. Among all cultivated and wild lentil species,L.nigricansexhibited the greatest allelic differentiation across the genome compared to all other species/subspecies. Major differences were observed on six genomic regions with the largest being on Chromosome 1 (c. 1 Mbp). These results indicate thatL. nigricansis the most distantly related toL. culinarisand additional structural variations are likely to be identified from genome sequencing studies. This would provide further insights into evolutionary relationships between cultivated and wild lentil germplasm, for germplasm improvement and introgression.	FRONT GENET		10.3389/fgene.2020.00546	  			TRUE	TRUE	did not investigate introgression	FALSE			FALSE
Rani, K; Raghu, BR; Jha, SK; Agarwal, P; Mallick, N; Niranjana, M; Sharma, JB; Singh, AK; Sharma, NK; Rajkumar, S; Tomar, SMS; Vinod	A novel leaf rust resistance gene introgressed from Aegilops markgrafii maps on chromosome arm 2AS of wheat	THEORETICAL AND APPLIED GENETICS		Key message A novel leaf rust resistance gene, LrM, introgressed from Aegilops markgrafii and mapped on chromosome 2AS using SSR- and SNP-based PCR markers will aid in broadening the genetic base of rust resistance in wheat. A new leaf rust resistance gene tentatively named LrM was introgressed from the diploid non-progenitor species Ae. markgrafii (2n = 2x = 14, genome CC) into common wheat using the nulli-5B mechanism. The introgression line ER9-700 showed a high degree of resistance against a wide spectrum of Puccinia triticina pathotypes. Genetic analysis was performed using the F-1, F-2, F-2:3 and BC1F1 generations derived from the cross ER9-700/Agra Local. The results showed a single dominant gene for leaf rust resistance. The resistance gene LrM was mapped on chromosome arm 2AS using SSR- and SNP-based PCR markers. Preliminary mapping with SSR markers in the F-2:3 population from the cross ER9-700/Agra Local identified two SSR markers flanking the LrM. SNPs were identified in the genomic region flanked by SSR markers, and SNP-based PCR markers were developed to construct the final map. Three SNP-based PCR markers co-segregated and mapped closest to the resistance gene at a distance of 2 cM. The gene LrM was distinguished from all the other genes designated and mapped on chromosome arm 2AS by molecular markers and rust reaction. All five markers used in the mapping amplified identical alleles in the donor Ae. markgrafii accession and introgression line ER9-700. The chromosomal location and rust reaction suggest that LrM is a novel leaf rust resistance gene that may be useful in broadening the genetic base of leaf rust resistance in wheat.	THEOR APPL GENET		10.1007/s00122-020-03625-w	  			TRUE	TRUE	manipulative cross	FALSE			FALSE
Li, L; Zhang, J; Lu, ZQ; Zhao, JL; Li, QJ	Genomic data reveal two distinct species from the widespread alpine ginger Roscoea tibetica Batalin (Zingiberaceae)	JOURNAL OF SYSTEMATICS AND EVOLUTION	cryptic species; genotyping by sequencing; phylogenomics; Roscoea tibetica; species delimitation	Species delimitation is a key foundation for exploring biodiversity. However, the existence of continuous phenotypic variation in widespread species challenges accurate species delimitation based on classical taxonomy. In this study, we investigated the cryptic diversity of a widespread herb (Roscoea tibetica Batalin) in a biodiversity hotspot (the Hengduan Mountains, China) using genotyping by sequencing, examining morphological traits, developing species distribution models, and simulating demographic history. Phylogenomic reconstruction, principal component analysis, and genetic structure inferences indicated that previously reported R. tibetica comprised two monophyletic lineages with a deep divergence. Several morphological diagnostic characteristics were discovered from field and common garden that corresponded to these independent evolutionary lineages. Species distribution models illustrated significant ecological divergence between both lineages. All evidence strongly supported that R. tibetica, as described in previous taxonomy, actually comprises two distinct species. Model test of gene flow and effective population size changes in fastsimcoal2, and a negative Tajima's D-value suggested that recent contact likely occurred between the two lineages. Our results proposed that cryptic diversity in previously reported R. tibetica was possibly associated with phenotypic plasticity in heterogeneous environments and morphological convergence in similar habitats. This study suggests that caution should be exercised when attempting to gain biological insight into species with large-scale morphological variation, and species delimitation should be done in advance.	J SYST EVOL		10.1111/jse.12596	  			TRUE	TRUE	did not investigate introgression	FALSE			FALSE
Abbasi, J; Xu, JL; Dehghani, H; Luo, MC; Deal, KR; McGuire, PE; Dvorak, J	Introgression of perennial growth habit from Lophopyrum elongatum into wheat	THEORETICAL AND APPLIED GENETICS		Key message A locus for perennial growth was mapped on Lophopyrum elongatum chromosome arm 4ES and introgressed into the wheat genome. Evidence was obtained that in addition to chromosome 4E, other L. elongatum chromosomes control perennial growth. Monocarpy versus polycarpy is one of the fundamental developmental dichotomies in flowering plants. Advances in the understanding of the genetic basis of this dichotomy are important for basic biological reasons and practically for genetic manipulation of growth development in economically important plants. Nine wheat introgression lines (ILs) harboring germplasm of the Lophopyrum elongatum genome present in the octoploid amphiploid Triticum aestivum cv. Chinese Spring (subgenomes AABBDD) x L. elongatum (genomes EE) were selected from a population of ILs developed earlier. These ILs were employed here in genomic analyses of post-sexual cycle regrowth (PSCR), which is a component of polycarpy in caespitose L. elongatum. Analyses of disomic substitution (DS) lines confirmed that L. elongatum chromosome 4E confers PSCR on wheat. The gene was mapped into a short distal region of L. elongatum arm 4ES and was tentatively named Pscr1. ILs harboring recombined chromosomes with 4ES segments, including Pscr1, incorporated into the distal part of the 4DS chromosome arm were identified. Based on the location, Pscr1 is not orthologous with the rice rhizome-development gene Rhz2 located on rice chromosome Os3, which is homoeologous with chromosome 4E, but it may correspond to the Teosinte branched1 (TB1) gene, which is located in the introgressed region in the L. elongatum and Ae. tauschii genomes. A hexaploid IL harboring a large portion of the E-genome but devoid of chromosome 4E also expressed PSCR, which provided evidence that perennial growth is controlled by genes on other L. elongatum chromosomes in addition to 4E.	THEOR APPL GENET		10.1007/s00122-020-03616-x	  			TRUE	TRUE	introgression lines	FALSE			FALSE
Wang, WX; Wang, ZH; Li, XT; Ni, ZF; Hu, ZR; Xin, MM; Peng, HR; Yao, YY; Sun, QX; Guo, WL	SnpHub: an easy-to-set-up web server framework for exploring large-scale genomic variation data in the post-genomic era with applications in wheat	GIGASCIENCE	SNP; database; server-framework; R/Shiny; wheat	Background: The cost of high-throughput sequencing is rapidly decreasing, allowing researchers to investigate genomic variations across hundreds or even thousands of samples in the post-genomic era. The management and exploration of these large-scale genomic variation data require programming skills. The public genotype querying databases of many species are usually centralized and implemented independently, making them difficult to update with new data over time. Currently, there is a lack of a widely used framework for setting up user-friendly web servers to explore new genomic variation data in diverse species. Results: Here, we present SnpHub, a Shiny/R-based server framework for retrieving, analysing, and visualizing large-scale genomic variation data that can be easily set up on any Linux server. After a pre-building process based on the provided VCF files and genome annotation files, the local server allows users to interactively access single-nucleotide polymorphisms and small insertions/deletions with annotation information by locus or gene and to define sample sets through a web page. Users can freely analyse and visualize genomic variations in heatmaps, phylogenetic trees, haplotype networks, or geographical maps. Sample-specific sequences can be accessed as replaced by detected sequence variations. Conclusions: SnpHub can be applied to any species, and we build up a SnpHub portal website for wheat and its progenitors based on published data in recent studies.	GIGASCIENCE		10.1093/gigascience/giaa060	  			TRUE	TRUE	methods paper	FALSE			FALSE
Mathieson, I	Human adaptation over the past 40,000 years	CURRENT OPINION IN GENETICS & DEVELOPMENT		Over the past few years several methodological and data-driven advances have greatly improved our ability to robustly detect genomic signatures of selection in humans. New methods applied to large samples of present-day genomes provide increased power, while ancient DNA allows precise estimation of timing and tempo. However, despite these advances, we are still limited in our ability to translate these signatures into understanding about which traits were actually under selection, and why. Combining information from different populations and timescales may allow interpretation of selective sweeps. Other modes of selection have proved more difficult to detect. In particular, despite strong evidence of the polygenicity of most human traits, evidence for polygenic selection is weak, and its importance in recent human evolution remains unclear. Balancing selection and archaic introgression seem important for the maintenance of potentially adaptive immune diversity, but perhaps less so for other traits.	CURR OPIN GENET DEV		10.1016/j.gde.2020.06.003	  			TRUE	TRUE	review paper	FALSE			FALSE
Setter, D; Mousset, S; Cheng, XH; Nielsen, R; DeGiorgio, M; Hermisson, J	VolcanoFinder: Genomic scans for adaptive introgression	PLOS GENETICS		Author summary The process by which beneficial alleles are introduced into a species from a closely-related species is termed adaptive introgression. We present an analytically-tractable model for the effects of adaptive introgression on non-adaptive genetic variation in the genomic region surrounding the beneficial allele. The result we describe is a characteristic volcano-shaped pattern of increased variability that arises around the positively-selected site, and we introduce an open-source methodVolcanoFinderto detect this signal in genomic data. Importantly,VolcanoFinderis a population-genetic likelihood-based approach, rather than a comparative-genomic approach, and can therefore probe genomic variation data from a single population for footprints of adaptive introgression, even froma prioriunknown and possibly extinct donor species. Recent research shows that introgression between closely-related species is an important source of adaptive alleles for a wide range of taxa. Typically, detection of adaptive introgression from genomic data relies on comparative analyses that require sequence data from both the recipient and the donor species. However, in many cases, the donor is unknown or the data is not currently available. Here, we introduce a genome-scan method-VolcanoFinder-to detect recent events of adaptive introgression using polymorphism data from the recipient species only.VolcanoFinderdetects adaptive introgression sweeps from the pattern of excess intermediate-frequency polymorphism they produce in the flanking region of the genome, a pattern which appears as a volcano-shape in pairwise genetic diversity. Using coalescent theory, we derive analytical predictions for these patterns. Based on these results, we develop a composite-likelihood test to detect signatures of adaptive introgression relative to the genomic background. Simulation results show thatVolcanoFinderhas high statistical power to detect these signatures, even for older sweeps and for soft sweeps initiated by multiple migrant haplotypes. Finally, we implementVolcanoFinderto detect archaic introgression in European and sub-Saharan African human populations, and uncovered interesting candidates in both populations, such asTSHRin Europeans andTCHH-RPTNin Africans. We discuss their biological implications and provide guidelines for identifying and circumventing artifactual signals during empirical applications ofVolcanoFinder.	PLOS GENET		10.1371/journal.pgen.1008867	  			TRUE	TRUE	methods paper	FALSE			FALSE
Senturk, N; Ergoren, MC	Developing an Online Portal for Determining the Genomic Signature of Archaic DNA that are Associated to Modern Human Genetic Diseases: A Meta-Analysis Study	EURASIAN JOURNAL OF MEDICINE	Archaic DNA; single nucleotide polymorphism; toll-like receptor	Objective: Mutations or introgression can cause and rise adaptive alleles of which some can be beneficial. Archaic humans lived more than 200,000 years ago in Europe and Western Asia. They were adapted to the environment and pathogens that prevailed in these locations. It can therefore be thought that modern humans obtained significant immune advantage from the archaic alleles. Materials and Methods: First, data were collected by meta-analysis from previously identified genetic diseases caused by alleles that were introgressed from archaics. Second, the in silico model portal (http://www.archaics2phenotype.xxx.edu.tr) was designed to trace the history of the Neanderthal allele. The portal also shows the current distribution of the genotypes of the selected alleles within different populations and correlates with the individuals phenotype. Results: Our developed model provides a better understanding for the origin of genetic diseases or traits that are associated with the Neanderthal genome. Conclusion: The developed medicine model will help individuals and their populations to receive the best treatment. It also clarifies why there are differences in disease phenotypes in modern humans.	EURASIAN J MED		10.5152/eurasianjmed.2019.18424	  			TRUE	TRUE	did not investigate introgression	FALSE			FALSE
Rees, JS; Castellano, S; Andres, AM	The Genomics of Human Local Adaptation	TRENDS IN GENETICS		Modern humans inhabit a variety of environments and are exposed to a plethora of selective pressures, leading to multiple genetic adaptations to local environmental conditions. These include adaptations to climate, UV exposure, disease, diet, altitude, or cultural practice and have generated important genetic and phenotypic differences amongst populations. In recent years, new methods to identify the genomic signatures of natural selection underlying these adaptations, combined with novel types of genetic data (e.g., ancient DNA), have provided unprecedented insights into the origin of adaptive alleles and the modes of adaptation. As a result, numerous instances of local adaptation have been identified in humans. Here, we review the most exciting recent developments and discuss, in our view, the future of this field.	TRENDS GENET		10.1016/j.tig.2020.03.006	  			TRUE	TRUE	review paper	FALSE			FALSE
