Leal, BSS; Brandao, MM; Palma-Silva, C; Pinheiro, F	Differential gene expression reveals mechanisms related to habitat divergence between hybridizing orchids from the Neotropical coastal plains	BMC PLANT BIOLOGY	Ecological genomics; Edaphic adaptation; Neotropical speciation; Orchids; Restingas; Transcription profile	BackgroundClosely related hybridizing species are ideal systems for identifying genomic regions underlying adaptive divergence. Although gene expression plays a central role in determining ecologically-based phenotypic differences, few studies have inferred the role of gene expression for adaptive divergence in Neotropical systems. In this study, we conduct genome-wide expression analysis alongside soil elemental analysis in sympatric and allopatric populations of Epidendrum fulgens and E. puniceoluteum (Orchidaceae), which occur in contrasting adjacent habitats in the Neotropical coastal plains.ResultsThese species were highly differentiated by their gene expression profiles, as determined by 18-21% of transcripts. Gene ontology (GO) terms associated with reproductive processes were enriched according to comparisons between species in both allopatric and sympatric populations. Species showed differential expression in genes linked to salt and waterlogging tolerance according to comparisons between species in sympatry, and biological processes related to environmental stimulus appeared as representative among those transcripts associated with edaphic characteristics in each sympatric zone. Hybrids, in their turn, were well differentiated from E. fulgens, but exhibited a similar gene expression profile to flooding-tolerant E. puniceolutem. When compared with parental species, hybrids showed no transcripts with additive pattern of expression and increased expression for almost all transgressive transcripts.ConclusionsThis study sheds light on general mechanisms promoting ecological differentiation and assortative mating, and suggests candidate genes, such as those encoding catalase and calcium-dependent protein kinase, underling adaptation to harsh edaphic conditions in the Neotropical coastal plains. Moreover, it demonstrates that differential gene expression plays a central role in determining ecologically-based phenotypic differences among co-occurring species and their hybrids.	BMC PLANT BIOL		10.1186/s12870-020-02757-x	  			TRUE	TRUE	did not investigate introgression	FALSE			FALSE
Tennessen, JA; Ingham, VA; Toe, KH; Guelbeogo, WM; Sagnon, N; Kuzma, R; Ranson, H; Neafsey, DE	A population genomic unveiling of a new cryptic mosquito taxon within the malaria-transmitting Anopheles gambiae complex	MOLECULAR ECOLOGY	admixture; Anopheles; cryptic taxa; reproductive barrier; selective sweep; vector	The Anopheles gambiae complex consists of multiple morphologically indistinguishable mosquito species including the most important vectors of the malaria parasite Plasmodium falciparum in sub-Saharan Africa. Nine cryptic species have been described so far within the complex. The ecological, immunological and reproductive differences among these species will critically impact population responses to disease control strategies and environmental changes. Here, we examine whole-genome sequencing data from a longitudinal study of putative A. coluzzii in western Burkina Faso. Surprisingly, many specimens are genetically divergent from A. coluzzii and all other Anopheles species and represent a new taxon, here designated Anopheles TENGRELA (AT). Population genetic analysis suggests that the cryptic GOUNDRY subgroup, previously collected as larvae in central Burkina Faso, represents an admixed population descended from both A. coluzzii and AT. AT harbours low nucleotide diversity except for the 2La inversion polymorphism which is maintained by overdominance. It shows numerous fixed differences with A. coluzzii concentrated in several regions reflecting selective sweeps, but the two taxa are identical at standard diagnostic loci used for taxon identification, and thus, AT may often go unnoticed. We present an amplicon-based genotyping assay for identifying AT which could be usefully applied to numerous existing samples. Misidentified cryptic taxa could seriously confound ongoing studies of Anopheles ecology and evolution in western Africa, including phenotypic and genotypic surveys of insecticide resistance. Reproductive barriers between cryptic species may also complicate novel vector control efforts, for example gene drives, and hinder predictions about evolutionary dynamics of Anopheles and Plasmodium.	MOL ECOL		10.1111/mec.15756	  			TRUE	TRUE	did not investigate introgression	FALSE			FALSE
Smolinsky, R; Balaz, V; Nurnberger, B	Tadpoles of hybridising fire-bellied toads (B. bombina and B. variegata) differ in their susceptibility to predation	PLOS ONE		The role of adaptive divergence in the formation of new species has been the subject of much recent debate. The most direct evidence comes from traits that can be shown to have diverged under natural selection and that now contribute to reproductive isolation. Here, we investigate differential adaptation of two fire-bellied toads (Anura, Bombinatoridae) to two types of aquatic habitat. Bombina bombina and B. variegata are two anciently diverged taxa that now reproduce in predator-rich ponds and ephemeral aquatic sites, respectively. Nevertheless, they hybridise extensively wherever their distribution ranges adjoin. We show in laboratory experiments that, as expected, B. variegata tadpoles are at relatively greater risk of predation from dragonfly larvae, even when they display a predator-induced phenotype. These tadpoles spent relatively more time swimming and so prompted more attacks from the visually hunting predators. We argue in the discussion that genomic regions linked to high activity in B. variegata should be barred from introgression into the B. bombina gene pool and thus contribute to gene flow barriers that keep the two taxa from merging into one.	PLOS ONE		10.1371/journal.pone.0231804	  			TRUE	TRUE	did not investigate introgression	FALSE			FALSE
Miedaner, T; Boeven, ALGC; Gaikpa, DS; Kistner, MB; Grote, CP	Genomics-Assisted Breeding for Quantitative Disease Resistances in Small-Grain Cereals and Maize	INTERNATIONAL JOURNAL OF MOLECULAR SCIENCES	resistance breeding; small-grain cereals; Fusarium head blight; wheat; Septoria tritici blotch; wheat; Septoria nodorum blotch; maize; Gibberella and Fusarium ear rot; maize; Northern corn leaf blight; multi-disease resistance (MDR); genetic resources	Generating genomics-driven knowledge opens a way to accelerate the resistance breeding process by family or population mapping and genomic selection. Important prerequisites are large populations that are genomically analyzed by medium- to high-density marker arrays and extensive phenotyping across locations and years of the same populations. The latter is important to train a genomic model that is used to predict genomic estimated breeding values of phenotypically untested genotypes. After reviewing the specific features of quantitative resistances and the basic genomic techniques, the possibilities for genomics-assisted breeding are evaluated for six pathosystems with hemi-biotrophic fungi: Small-grain cereals/Fusarium head blight (FHB), wheat/Septoria tritici blotch (STB) and Septoria nodorum blotch (SNB), maize/Gibberella ear rot (GER) and Fusarium ear rot (FER), maize/Northern corn leaf blight (NCLB). Typically, all quantitative disease resistances are caused by hundreds of QTL scattered across the whole genome, but often available in hotspots as exemplified for NCLB resistance in maize. Because all crops are suffering from many diseases, multi-disease resistance (MDR) is an attractive aim that can be selected by specific MDR QTL. Finally, the integration of genomic data in the breeding process for introgression of genetic resources and for the improvement within elite materials is discussed.	INT J MOL SCI		10.3390/ijms21249717	  			TRUE	TRUE	review paper	FALSE			FALSE
Chen, HL; German, DA; Al-Shehbaz, IA; Yue, JP; Sun, H	Phylogeny of Euclidieae (Brassicaceae) based on plastome and nuclear ribosomal DNA data	MOLECULAR PHYLOGENETICS AND EVOLUTION	Plastid genome; Euclidieae; Phylogenomics; Molecular dating; Ndh genes loss	Euclidieae, a morphologically diverse tribe in the family Brassicaceae (Cruciferae), consists of 29 genera and more than 150 species distributed mainly in Asia. Prior phylogenetic analyses on Euclidieae are inadequate. In this study, sequence data from the plastid genome and nuclear ribosomal DNA of 72 species in 27 genera of Euclidieae were used to infer the inter- and infra-generic relationships within. The well-resolved and strongly supported plastome phylogenies revealed that Euclidieae could be divided into five clades. Both Cymatocarpus and Neotorularia are polyphyletic in nuclear and plastome phylogenies. Besides, the conflicts of systematic positions of three species of Braya and two species of Solms-laubachia s.l. indicated that hybridization and or introgression might have happened during the evolutionary history of the tribe. Results from divergence-time analyses suggested an early Miocene origin of Euclidieae, and it probably originated from the Central Asia, Pamir Plateau and West Himalaya. In addition, multiple ndh genes loss and pseudogenization were detected in eight species based on comparative genomic study.	MOL PHYLOGENET EVOL		10.1016/j.ympev.2020.106940	  			TRUE	TRUE	did not investigate introgression	FALSE			FALSE
Hirase, S; Tezuka, A; Nagano, AJ; Sato, M; Hosoya, S; Kikuchi, K; Iwasaki, W	Integrative genomic phylogeography reveals signs of mitonuclear incompatibility in a natural hybrid goby population	EVOLUTION	Dobzhansky&#8208; Muller incompatibility; hybridization; microRNA; mitonuclear interactions; oxidative phosphorylation; secondary contact	Hybridization between divergent lineages generates new allelic combinations. One mechanism that can hinder the formation of hybrid populations is mitonuclear incompatibility, that is, dysfunctional interactions between proteins encoded in the nuclear and mitochondrial genomes (mitogenomes) of diverged lineages. Theoretically, selective pressure due to mitonuclear incompatibility can affect genotypes in a hybrid population in which nuclear genomes and mitogenomes from divergent lineages admix. To directly and thoroughly observe this key process, we de novo sequenced the 747-Mb genome of the coastal goby, Chaenogobius annularis, and investigated its integrative genomic phylogeographics using RNA-sequencing, RAD-sequencing, genome resequencing, whole mitogenome sequencing, amplicon sequencing, and small RNA-sequencing. Chaenogobius annularis populations have been geographically separated into Pacific Ocean (PO) and Sea of Japan (SJ) lineages by past isolation events around the Japanese archipelago. Despite the divergence history and potential mitonuclear incompatibility between these lineages, the mitogenomes of the PO and SJ lineages have coexisted for generations in a hybrid population on the Sanriku Coast. Our analyses revealed accumulation of nonsynonymous substitutions in the PO-lineage mitogenomes, including two convergent substitutions, as well as signals of mitochondrial lineage-specific selection on mitochondria-related nuclear genes. Finally, our data implied that a microRNA gene was involved in resolving mitonuclear incompatibility. Our integrative genomic phylogeographic approach revealed that mitonuclear incompatibility can affect genome evolution in a natural hybrid population.	EVOLUTION		10.1111/evo.14120	  			TRUE	TRUE	did not investigate introgression	FALSE			FALSE
Kumari, P; Singh, KP; Kumar, S; Yadava, DK	Development of a Yellow-Seeded Stable Allohexaploid Brassica Through Inter-Generic Somatic Hybridization With a High Degree of Fertility and Resistance to Sclerotinia sclerotiorum	FRONTIERS IN PLANT SCIENCE	inter-generic somatic hybridization; allohexaploids brassica; genomic in situ hybridization; seed color; Sclerotinia sclerotiorum resistance; Sinapis alba	The Brassica coenospeceis have treasure troves of genes that could be beneficial if introgressed into cultivated Brassicas to combat the current conditions of climate change. Introducing genetic variability through plant speciation with polyploidization is well documented, where ploidy augmentation of inter-generic allohexaploids using somatic hybridization has significantly contributed to genetic base broadening. Sinapis alba is a member of the Brassicaceae family that possesses valuable genes, including genes conferring resistance to Sclerotinia sclerotiorum, Alternaria brassicae, pod shattering, heat, and drought stress. This work aimed to synthesize stable allohexaploid (AABBSS) Brassica while incorporating the yellow-seed trait and resistance to S. sclerotiorum stem rot. The two fertile and stable allohexaploids were developed by polyethylene glycol mediated protoplast fusions between Brassica juncea (AABB) and S. alba (SS) and named as JS1 and JS2. These symmetric hybrids (2n = 60) were validated using morphological and molecular cytology techniques and were found to be stable over consecutive generations. The complete chromosome constitution of the three genomes was determined through genomic in situ hybridization of mitotic cells probed with S. alba genomic DNA labeled with fluorescein isothiocyanate. These two allohexaploids showed 24 hybridization signals demonstrating the presence of complete diploid chromosomes from S. alba and 36 chromosomes from B. juncea. The meiotic pollen mother cell showed 30 bivalent sets of all the 60 chromosomes and none of univalent or trivalent observed during meiosis. Moreover, the backcross progeny 1 plant revealed 12 hybridization signals out of a total of 48 chromosome counts. Proper pairing and separation were recorded at the meiotic metaphase and anaphase, which proved the stability of the allohexaploid and their backcross progeny. When screening, the allohexaploid (JS2) of B. juncea and S. alba displayed a high degree of resistance to S. sclerotiorum rot along with a half-yellow and half-brown (mosaic) seed coat color, while the B. juncea and S. alba allohexaplopid1 (JS1) displayed a yellow seed coat color with the same degree of resistance to Sclerotinia rot.	FRONT PLANT SCI		10.3389/fpls.2020.575591	  			TRUE	TRUE	manipulative cross	FALSE			FALSE
Shaibu, AS; Miko, ZL; Ajeigbe, HA; Mohammed, SG; Usman, A; Muhammad, MS; Umar, ML; Ahmed, HO; Adnan, AA; Sneller, C	Genome-wide detection of markers associated with early leaf spot and pod weight in groundnut using SNP and DArT markers	JOURNAL OF CROP IMPROVEMENT	DArT-seq (TM); early leaf spot; groundnut; marker-trait association; pod weight; single nucleotide polymorphism	Early leaf spot (ELS) disease, caused by Cercospora arachidicola S. Hori, severely affects groundnut (Arachis hypogaea L.) production worldwide. Breeding for resistant varieties using conventional breeding is difficult because multiple genes control the resistance and heritability is moderate. Our objective was to identify marker-trait associations (MTAs) for ELS resistance in a mini-core collection of 168 accessions. The accessions were genotyped using diversity array technology (DArTseq (TM)) and phenotyped at two locations with and without inoculation. Two types of DArTseq markers were scored; Silico DArT markers and biallelic single nucleotide polymorphism (SNP) markers. Genotype effects were significant for both ELS and pod weight (PW), with several accessions showing good levels for resistance. The heritability of ELS was moderate (0.37 to 0.64), whereas heritability for PW was low (0.10 to 0.18). The DArTseq generated 3592 biallelic SNP markers and 15,237 dominant silico markers. The distribution of the biallelic and dominant markers across the genome shows that chromosomes B04 and A04 had the highest number of markers. The MTA analysis revealed 25 significant (p < 0.001) MTAs. One MTA for ELS was found across treatments and rating dates and may be suitable for marker-assisted selection upon validation. No MTA for PW was repeatable. The germplasm and markers identified in this study can serve as useful genomic resources to initiate marker-assisted selection and trait introgression for ELS resistance in groundnut.	J CROP IMPROV		10.1080/15427528.2020.1846102	  			TRUE	TRUE	did not investigate introgression	FALSE			FALSE
Song, YJ; Dang, JB; Chen, WW; Wen, G; He, Q; Li, XL; Lin, SK; Liang, GL; Guo, QG	An allotriploid hybrid developed from a female 2n gamete was obtained from Eriobotrya japonica (Thunb.) Lindl x E. deflexa (Hemsl.) Nakai	EUPHYTICA	Loquat; Bronze loquat; Interspecific hybridization; Allotriploid	A triploid was obtained from loquat (Eriobotrya japonica cv. 'Ninghaibai') (2n = 2x = 34) x bronze loquat (Eriobotrya deflexa, 2n = 2x = 34). The leaves of the triploid had no petioles, similar to the female parent, and its stipules were obvious and dark green, similar to those of the male parent. There were signals of male parent DNA on ten chromosomes of the triploid according to genomic in situ hybridization (GISH) when DNA of bronze loquat was used as probe; the diploid hybrid also had ten chromosomes with signals of male parent DNA. All five selected simple sequence repeats (SSR) primers amplified specific loci of both parents. In particular, primer CH04c06 amplified both specific loci of the female parent but only amplified one specific locus of the male parent. The results of GISH and SSR marker analysis indicated that the 2n gamete which formed the triploid was from first-division restitution or pre-meiotic doubling of the female parent cv. 'Ninghaibai'. The allotriploid can be used to breed seedless loquat germplasm with different flowering times from loquat directly or to breed new germplasm containing a few genomic components from bronze loquat, such as monosomic alien addition lines, monosomic alien substitution lines, and introgression lines. This is the first report of allotriploid in the genus Eriobotrya and it will provide a basis for breeding new loquat germplasms by distant hybridization and provide an ideal material for breeding new loquat varieties with different flowering time or time to maturity.	EUPHYTICA		10.1007/s10681-020-02719-2	  			TRUE	TRUE	manipulative cross	FALSE			FALSE
D'Angiolo, M; De Chiara, M; Yue, JX; Irizar, A; Stenberg, S; Persson, K; Llored, A; Barre, B; Schacherer, J; Marangoni, R; Gilson, E; Warringer, J; Liti, G	A yeast living ancestor reveals the origin of genomic introgressions	NATURE		A yeast clonal descendant of an ancient hybridization event is identified and sheds light on the early evolution of the Saccharomyces cerevisiae Alpechin lineage and its abundant Saccharomyces paradoxus introgressions. Genome introgressions drive evolution across the animal(1), plant(2) and fungal(3) kingdoms. Introgressions initiate from archaic admixtures followed by repeated backcrossing to one parental species. However, how introgressions arise in reproductively isolated species, such as yeast(4), has remained unclear. Here we identify a clonal descendant of the ancestral yeast hybrid that founded the extant Saccharomyces cerevisiae Alpechin lineage(5), which carries abundant Saccharomyces paradoxus introgressions. We show that this clonal descendant, hereafter defined as a 'living ancestor', retained the ancestral genome structure of the first-generation hybrid with contiguous S. cerevisiae and S. paradoxus subgenomes. The ancestral first-generation hybrid underwent catastrophic genomic instability through more than a hundred mitotic recombination events, mainly manifesting as homozygous genome blocks generated by loss of heterozygosity. These homozygous sequence blocks rescue hybrid fertility by restoring meiotic recombination and are the direct origins of the introgressions present in the Alpechin lineage. We suggest a plausible route for introgression evolution through the reconstruction of extinct stages and propose that genome instability allows hybrids to overcome reproductive isolation and enables introgressions to emerge.	NATURE		10.1038/s41586-020-2889-1	  			TRUE	TRUE	manipulative cross	FALSE			FALSE
Cui, L; Ren, YK; Zhang, YM; Tang, ZH; Guo, Q; Niu, YQ; Yan, WZ; Sun, Y; Li, HJ	Characterization of Resistance to Cereal Cyst Nematode, Agronomic Performance, and End-Use Quality Parameters in Four Perennial Wheat-Thinopyrum intermedium Lines	FRONTIERS IN PLANT SCIENCE	perennial wheat; Thinopyrum intermedium; cereal cyst nematode; agronomic performance; end-use quality parameters; molecular cytogenetic analysis	Perennial wheat is considered to be a practical way to increase the flexibility and profitability of sustainable agricultural system, as it can be either a forage grass or a grain crop. Four perennial wheat lines SX12-480, SX12-787, SX12-1150, and SX12-1269 were developed from a series of interspecific crosses between common wheat (Triticum aestivum, 2n = 42) or durum wheat (T. turgidum var. durum, 2n = 28) and the intermediate wheatgrass (Thinopyrum intermedium, 2n = 42). These lines were characterized by the vigorous regrowth for at least 3 years. The one- and 2-year-old plants had higher grain yield potential than the 3-year-old perennial plants. The decline of grain yield was associated with plant age-related effects on yield components. The perennial wheat lines were all resistant to both Heterodera avenae and H. filipjevi, the two distinct cereal cyst nematode species that occur in China, except that line SX12-787 exhibited moderate resistance only to H. avenae. The dual-purpose perennial wheat lines were evaluated for quality values of both defoliated grass and harvested grains in the form of amino acid profile, mineral concentration, and contents of protein and fiber. Difference in the quality profile was observed between the perennial lines. These perennial lines had an overall improved quality levels over those of the perennial wheat control Montana-2 (T. turgidum x Th. intermedium) and the annual wheat cultivar Jinchun 9. The amplification profiles of the molecular markers provided molecular evidence for the introgression of alien chromatin. Genomic in situ hybridization detected 16, 14, 14, and 12 Th. intermedium chromosomes in lines SX12-480 (2n = 48), SX12-787 (2n = 56), SX12-1150 (2n = 56), and SX12-1269 (2n = 54), respectively, in addition to either 32 or the complete set of wheat chromosomes. The four perennial wheat-Th. intermedium lines described here provide valuable sources of perennial wheat for the dual-purpose application of both grain and forage.	FRONT PLANT SCI		10.3389/fpls.2020.594197	  			TRUE	TRUE	manipulative cross	FALSE			FALSE
Gerdol, M; Moreira, R; Cruz, F; Gomez-Garrido, J; Vlasova, A; Rosani, U; Venier, P; Naranjo-Ortiz, MA; Murgarella, M; Greco, S; Balseiro, P; Corvelo, A; Frias, L; Gut, M; Gabaldon, T; Pallavicini, A; Canchaya, C; Novoa, B; Alioto, TS; Posada, D; Figueras, A	Massive gene presence-absence variation shapes an open pan-genome in the Mediterranean mussel	GENOME BIOLOGY	Mussel; Bivalve; Pan-genome; Presence-absence variation; Structural variants; Hemizygosity; Dispensable gene; Phylome; Innate immunity; Antimicrobial peptides	Background The Mediterranean mussel Mytilus galloprovincialis is an ecologically and economically relevant edible marine bivalve, highly invasive and resilient to biotic and abiotic stressors causing recurrent massive mortalities in other bivalves. Although these traits have been recently linked with the maintenance of a high genetic variation within natural populations, the factors underlying the evolutionary success of this species remain unclear. Results Here, after the assembly of a 1.28-Gb reference genome and the resequencing of 14 individuals from two independent populations, we reveal a complex pan-genomic architecture in M. galloprovincialis, with a core set of 45,000 genes plus a strikingly high number of dispensable genes (20,000) subject to presence-absence variation, which may be entirely missing in several individuals. We show that dispensable genes are associated with hemizygous genomic regions affected by structural variants, which overall account for nearly 580 Mb of DNA sequence not included in the reference genome assembly. As such, this is the first study to report the widespread occurrence of gene presence-absence variation at a whole-genome scale in the animal kingdom. Conclusions Dispensable genes usually belong to young and recently expanded gene families enriched in survival functions, which might be the key to explain the resilience and invasiveness of this species. This unique pan-genome architecture is characterized by dispensable genes in accessory genomic regions that exceed by orders of magnitude those observed in other metazoans, including humans, and closely mirror the open pan-genomes found in prokaryotes and in a few non-metazoan eukaryotes.	GENOME BIOL		10.1186/s13059-020-02180-3	  			TRUE	TRUE	mtDNA	FALSE			FALSE
